Title	Authors	Pdf	Presentation	Volume_Name	Notes
Preface	Shoichi Yokoyama	http://www.mt-archive.info/10/MTS-2013-W1-Yokoyama-1.pdf			Table of Contents
On integrating hybrid and rule-based components for patent MT with several levels of output	Svetlana Sheremetyeva	http://www.mt-archive.info/10/MTS-2013-W1-Sheremetyeva.pdf			Table of Contents
Compositional translation of technical terms by integrating patent families as a parallel corpus and a comparable corpus	Itsuki Toyota and Zi Long and Lijuan Dong and Takehito Utsuro and Mikio Yamamoto	http://www.mt-archive.info/10/MTS-2013-W1-Toyota.pdf			Table of Contents
Analysis of parallel structures in patent sentences, focusing on the head words	Soichi Yokoyama	http://www.mt-archive.info/10/MTS-2013-W1-Yokoyama-2.pdf			Table of Contents
Patent translation as technical document translation: customizing a Chinese-Korean MT system to patent domain	Yun Jin and Oh-Woog Kwon and Seung-Hoon Na and Young-Gil Kim	http://www.mt-archive.info/10/MTS-2013-W1-Jin.pdf			Table of Contents
Exploiting multiple resources for Japanese to English patent translation	Rahma Sellami and Fatiha Sadat and Lamia Hadrich Belguith	http://www.mt-archive.info/10/MTS-2013-W1-Sellami.pdf			Table of Contents
